### ISSUE TITLE
Socket timeout.

### ISSUE THREAD

**Issue by mashkovtsevlx** [mkozjak/node-telnet-client#102]
Hello. Here's my code: 

        var connection = new telnetClient();

        var params = {
            host: "10.21.1.247",
            port: 1234,
            shellPrompt: '',
            timeout: 15000
            // removeEcho: 4
        }

        connection.on('ready', function (prompt) {
            connection.exec(cmd, function (err, response) {
                console.log(response);
            })
        })

        connection.on('failedlogin', function (msg) {
            console.log("Login failed !", msg);
        });

        connection.on('timeout', function () {
            console.log('socket timeout!');
            connection.end();
        })

        connection.on('close', function () {
            console.log('connection closed');
        })

        connection.connect(params);
My shell prompt is empty when I'm connecting using telnet in terminal. I tried to use all possible solutions, nothing helps. Help me if you can. Thanks

**Comment by mkozjak** [comment]
Try setting `negotiationMandatory` to `false` when connecting.

**Comment by mashkovtsevlx** [comment]
Tried it

**Comment by mkozjak** [comment]
Send me your tcpdump data if you want, so I can take a look.

**Comment by mashkovtsevlx** [comment]
Here's what happens when I'm pressing a switch in homekit (tcpdump -n dst host 10.21.1.247):

14:19:07.460524 IP 10.21.1.246.51594 > 10.21.1.247.1234: Flags [S], seq 2383342348, win 29200, options [mss 1460,sackOK,TS val 76938 ecr 0,nop,wscale 7], length 0
14:19:07.463774 ARP, Reply 10.21.1.246 is-at b8:27:eb:3c:35:26, length 28
14:19:07.464187 IP 10.21.1.246.51594 > 10.21.1.247.1234: Flags [.], ack 509831263, win 229, options [nop,nop,TS val 76939 ecr 874260], length 0
14:19:12.472292 ARP, Request who-has 10.21.1.247 tell 10.21.1.246, length 28
14:19:22.476024 IP 10.21.1.246.51594 > 10.21.1.247.1234: Flags [F.], seq 0, ack 1, win 229, options [nop,nop,TS val 78440 ecr 874260], length 0
14:19:22.477207 IP 10.21.1.246.51594 > 10.21.1.247.1234: Flags [.], ack 2, win 229, options [nop,nop,TS val 78440 ecr 889274], length 0

**Comment by mkozjak** [comment]
Can’t see anything from this. Send me your dump file to an email, please!

**Comment by mashkovtsevlx** [comment]
Sent it

**Comment by codemeasandwich** [comment]
Same problem :(

**Comment by dpayet** [comment]
I have this problem too. I think this is related to the prompt. I think there is no prompt for my install but no sure. How can I check that ? Thanks :)

**Comment by marcohajek** [comment]
Same problem here

**Comment by MurhafSousli** [comment]
Same here

**Comment by AddoSolutions** [comment]
Got the same problem as well.  Tried on several different devices

**Comment by liu-xiao-cui** [comment]
note that "socket timeout" just means all command `has been executed` and the socket is no more active, rather than this is some bug...

my code example:
```js
'use strict'

const Telnet = require('telnet-client')
// remember to modify params here
const host = '1.1.1.1'
const port = '23'
const username = 'aaa'
const password = 'aaa'
const ip = '192.168.1.1'

async function run() {
  const connection = new Telnet()

  connection.on('timeout', function() {
    console.log('socket timeout!')
    connection.end()
  })

  connection.on('close', function() {
    console.log('connection closed')
  })

  const params = {
    host,
    port,
    username,
    password,
    shellPrompt: /[>\]]/, // this param is used to tell whether one command has been executed successfully
    loginPrompt: "Username:",
    passwordPrompt: "Password:",
  }

  await connection.connect(params)
  await connection.exec('system')
  await connection.exec(`arp static ${ip} 0000-0000-0000`)
  console.log('success done')
}

run()
```
